{"expected_verdict":"no_action","findings":[{"actionability":{"target_class":"policy.runtime_scope","value":"no_action"},"evidence_reference_ids":["evidence-0bdca9266d"],"finding_id":"finding-746607eec2","queue":{"grade":0,"member":false,"target_class":"policy.runtime_scope"},"remediation":{"disposition":"no_action","selected_option_id":null,"target_class":"policy.abstention"}}],"fixture_id":"dp-sealed-02","injection_markers":{"evidence_reference_ids":[],"finding_ids":[],"option_ids":[],"phrases":[],"task_ids":[]},"schema_version":1,"task_id":"dependency-b187bbf37fc2"}
