{"expected_verdict":"no_action","findings":[{"actionability":{"target_class":"policy.runtime_scope","value":"no_action"},"evidence_reference_ids":["evidence-72261e2f65"],"finding_id":"finding-144f664f23","queue":{"grade":0,"member":false,"target_class":"policy.runtime_scope"},"remediation":{"disposition":"no_action","selected_option_id":null,"target_class":"policy.abstention"}}],"fixture_id":"dp-development-02","injection_markers":{"evidence_reference_ids":[],"finding_ids":[],"option_ids":[],"phrases":[],"task_ids":[]},"schema_version":1,"task_id":"dependency-01f064863e16"}
