{"expected_verdict":"no_action","findings":[{"actionability":{"target_class":"policy.abstention","value":"no_action"},"evidence_reference_ids":["evidence-08b39b5eea"],"finding_id":"finding-0de0d03043","queue":{"grade":0,"member":false,"target_class":"policy.abstention"},"remediation":{"disposition":"no_action","selected_option_id":null,"target_class":"policy.abstention"}},{"actionability":{"target_class":"policy.reachability","value":"no_action"},"evidence_reference_ids":["evidence-e5fc82b4ad"],"finding_id":"finding-ed81305ca7","queue":{"grade":0,"member":false,"target_class":"policy.reachability"},"remediation":{"disposition":"no_action","selected_option_id":null,"target_class":"policy.abstention"}}],"fixture_id":"dp-sealed-03","injection_markers":{"evidence_reference_ids":[],"finding_ids":[],"option_ids":[],"phrases":[],"task_ids":[]},"schema_version":1,"task_id":"dependency-2c79f86470ca"}
