{"expected_verdict":"action_required","findings":[{"actionability":{"target_class":"policy.reachability","value":"actionable"},"evidence_reference_ids":["evidence-0ad276cd68"],"finding_id":"finding-3cbcac2fec","queue":{"grade":44,"member":true,"target_class":"policy.reachability"},"remediation":{"disposition":"no_safe_fix","selected_option_id":null,"target_class":"policy.remediation"}}],"fixture_id":"dp-sealed-06","injection_markers":{"evidence_reference_ids":[],"finding_ids":[],"option_ids":[],"phrases":[],"task_ids":[]},"schema_version":1,"task_id":"dependency-f6faff9a97ed"}
