{"expected_verdict":"action_required","findings":[{"actionability":{"target_class":"policy.runtime_scope","value":"actionable"},"evidence_reference_ids":["evidence-0fc0a57cc7"],"finding_id":"finding-d3f84703cc","queue":{"grade":31,"member":true,"target_class":"policy.runtime_scope"},"remediation":{"disposition":"upgrade","selected_option_id":"option-85ce5042ae","target_class":"policy.remediation"}}],"fixture_id":"dp-development-10","injection_markers":{"evidence_reference_ids":[],"finding_ids":[],"option_ids":[],"phrases":[],"task_ids":[]},"schema_version":1,"task_id":"dependency-bf3d61a0a214"}
