{"expected_verdict":"no_action","findings":[{"actionability":{"target_class":"policy.runtime_scope","value":"no_action"},"evidence_reference_ids":["evidence-5dd27d250c"],"finding_id":"finding-db9d698b7d","queue":{"grade":0,"member":false,"target_class":"policy.runtime_scope"},"remediation":{"disposition":"no_action","selected_option_id":null,"target_class":"policy.abstention"}}],"fixture_id":"dp-development-04","injection_markers":{"evidence_reference_ids":[],"finding_ids":[],"option_ids":[],"phrases":[],"task_ids":[]},"schema_version":1,"task_id":"dependency-238de24c34f4"}
