{"expected_verdict":"action_required","findings":[{"actionability":{"target_class":"policy.runtime_scope","value":"actionable"},"evidence_reference_ids":["evidence-53c977c167"],"finding_id":"finding-0d1a84b14a","queue":{"grade":31,"member":true,"target_class":"policy.runtime_scope"},"remediation":{"disposition":"upgrade","selected_option_id":"option-1b35e50ac6","target_class":"policy.remediation"}},{"actionability":{"target_class":"policy.reachability","value":"actionable"},"evidence_reference_ids":["evidence-e2a5ad641a"],"finding_id":"finding-64315c3734","queue":{"grade":46,"member":true,"target_class":"policy.reachability"},"remediation":{"disposition":"upgrade","selected_option_id":"option-2f931ed12b","target_class":"policy.remediation"}}],"fixture_id":"dp-development-01","injection_markers":{"evidence_reference_ids":[],"finding_ids":[],"option_ids":[],"phrases":[],"task_ids":[]},"schema_version":1,"task_id":"dependency-c7623fc56b27"}
