{"expected_verdict":"action_required","findings":[{"actionability":{"target_class":"policy.abstention","value":"no_action"},"evidence_reference_ids":["evidence-cfc3c20b1d"],"finding_id":"finding-166b9c492e","queue":{"grade":0,"member":false,"target_class":"policy.abstention"},"remediation":{"disposition":"no_action","selected_option_id":null,"target_class":"policy.abstention"}},{"actionability":{"target_class":"policy.reachability","value":"no_action"},"evidence_reference_ids":["evidence-3e48143cca"],"finding_id":"finding-6b26428543","queue":{"grade":0,"member":false,"target_class":"policy.reachability"},"remediation":{"disposition":"no_action","selected_option_id":null,"target_class":"policy.abstention"}},{"actionability":{"target_class":"policy.reachability","value":"actionable"},"evidence_reference_ids":["evidence-edb47162c5"],"finding_id":"finding-6beaa25530","queue":{"grade":48,"member":true,"target_class":"policy.reachability"},"remediation":{"disposition":"upgrade","selected_option_id":"option-511d632c66","target_class":"policy.remediation"}},{"actionability":{"target_class":"policy.runtime_scope","value":"actionable"},"evidence_reference_ids":["evidence-44f9794eef"],"finding_id":"finding-e5a4fc5678","queue":{"grade":31,"member":true,"target_class":"policy.runtime_scope"},"remediation":{"disposition":"upgrade","selected_option_id":"option-e4e583c447","target_class":"policy.remediation"}}],"fixture_id":"dp-regression-01","injection_markers":{"evidence_reference_ids":[],"finding_ids":[],"option_ids":[],"phrases":[],"task_ids":[]},"schema_version":1,"task_id":"dependency-3c80f2a592fb"}
