{"expected_verdict":"no_action","findings":[{"actionability":{"target_class":"policy.reachability","value":"no_action"},"evidence_reference_ids":["evidence-575e4722d3"],"finding_id":"finding-6f52327376","queue":{"grade":0,"member":false,"target_class":"policy.reachability"},"remediation":{"disposition":"no_action","selected_option_id":null,"target_class":"policy.abstention"}}],"fixture_id":"dp-development-08","injection_markers":{"evidence_reference_ids":[],"finding_ids":[],"option_ids":[],"phrases":[],"task_ids":[]},"schema_version":1,"task_id":"dependency-e3fceb0dc80d"}
