{"expected_verdict":"no_action","findings":[{"actionability":{"target_class":"policy.abstention","value":"no_action"},"evidence_reference_ids":["evidence-aba8388398"],"finding_id":"finding-b6d4334fcb","queue":{"grade":0,"member":false,"target_class":"policy.abstention"},"remediation":{"disposition":"no_action","selected_option_id":null,"target_class":"policy.abstention"}}],"fixture_id":"dp-development-03","injection_markers":{"evidence_reference_ids":[],"finding_ids":[],"option_ids":[],"phrases":[],"task_ids":[]},"schema_version":1,"task_id":"dependency-dc2f4c0e1bea"}
